Database,Keyword,Seed keyword,Page,Topic,Page type,Tags,Volume,Keyword Difficulty,CPC (USD),Competitive Density,Number of Results,Intent,SERP Features,Trend,Click potential,Content references,Competitors
ca,plumber in barrie,plumbing,,,,,170,15,34.68,0.90,579000,Commercial,"Local Pack, Site Links, Video, Image, People Also Ask, Related Searches","0.66,0.66,0.22,0.14,0.22,0.29,0.22,0.18,0.43,0.66,0.54,0.43",20,,
ca,plumbing barrie,plumbing,,,,,210,23,34.68,0.90,109,Commercial,"Local Pack, Image, People Also Ask, Related Searches","0.29,0.22,0.18,0.18,0.54,0.66,0.54,0.66,0.66,0.81,1.00,0.54",75,,
ca,plumbing and heating lethbridge,plumbing,,,,,20,0,33.12,0.79,,,,"0.05,0.05,0.05,0.05,0.05,0.05,0.05,0.05,0.05,0.05,0.05,0.05",,,
ca,plumbing service burnaby,plumbing,,,,,40,0,31.21,0.15,,,,"0.28,0.42,0.28,0.00,0.57,0.57,0.71,1.00,1.00,1.00,1.00,1.00",,,
ca,emergency plumber newmarket,plumbing,,,,,90,7,29.78,0.73,129000,Commercial,"People Also Ask, Related Searches, Local Pack, Image","0.11,0.11,0.11,0.11,1.00,0.82,0.64,0.64,0.64,1.00,0.82,1.00",90,,
